{
 "schema_version": "1.0",
 "filing_id": "sedco_capital_reit_FY2022",
 "entity": "SEDCO Capital REIT Fund",
 "source": {
  "sha256": "1e1c3cab223cc8092045af45890f0b76bcdad68b9269c85e71f274d8a4ceb6b2",
  "file": "filings/sedco_capital_reit_FY2022.pdf"
 },
 "period_end": "2022-12-31",
 "report": "annual",
 "digits": "arabic-indic",
 "consolidated": false,
 "annotator": "the benchmark's annotator: transcribed by hand from the page images, without OCR or AI tools; automatic checks: arithmetic totals, plus the text layer where the page has one",
 "statements": [
  {
   "id": "s1",
   "type": "financial_position",
   "title_ar": "قائمة المركز المالي",
   "pages": [
    7
   ],
   "unit": {
    "currency": "SAR",
    "scale": 1
   },
   "columns": [
    {
     "id": "c1",
     "label": "2022م ريال سعودي",
     "currency": "SAR",
     "period": "2022-12-31"
    },
    {
     "id": "c2",
     "label": "2021م ريال سعودي",
     "currency": "SAR",
     "period": "2021-12-31"
    }
   ],
   "rows": [
    {
     "id": "r1",
     "kind": "section",
     "label_ar": "الموجودات"
    },
    {
     "id": "r2",
     "kind": "section",
     "label_ar": "الموجودات غير المتداولة"
    },
    {
     "id": "r3",
     "kind": "item",
     "label_ar": "عقارات استثمارية",
     "notes": [
      "5"
     ],
     "values": {
      "c1": 1760383078,
      "c2": 1633965863
     }
    },
    {
     "id": "r4",
     "kind": "subtotal",
     "label_ar": "مجموع الموجودات غير المتداولة",
     "values": {
      "c1": 1760383078,
      "c2": 1633965863
     },
     "sum_of": [
      "r3"
     ]
    },
    {
     "id": "r5",
     "kind": "section",
     "label_ar": "الموجودات المتداولة"
    },
    {
     "id": "r6",
     "kind": "item",
     "label_ar": "أدوات مشتقة بالقيمة العادلة من خلال قائمة الدخل",
     "notes": [
      "6"
     ],
     "values": {
      "c1": 21645322,
      "c2": 852014
     }
    },
    {
     "id": "r7",
     "kind": "item",
     "label_ar": "إيجار مستحق الاستلام",
     "notes": [
      "7"
     ],
     "values": {
      "c1": 29577661,
      "c2": 27500726
     }
    },
    {
     "id": "r8",
     "kind": "item",
     "label_ar": "مبالغ مدفوعة مقدماً وذمم مدينة أخرى",
     "values": {
      "c1": 6275396,
      "c2": 5169476
     }
    },
    {
     "id": "r9",
     "kind": "item",
     "label_ar": "النقد وما في حكمه",
     "notes": [
      "8"
     ],
     "values": {
      "c1": 26550920,
      "c2": 62053842
     }
    },
    {
     "id": "r10",
     "kind": "subtotal",
     "label_ar": "مجموع الموجودات المتداولة",
     "values": {
      "c1": 84049299,
      "c2": 95576058
     },
     "sum_of": [
      "r6",
      "r7",
      "r8",
      "r9"
     ]
    },
    {
     "id": "r11",
     "kind": "total",
     "label_ar": "مجموع الموجودات",
     "values": {
      "c1": 1844432377,
      "c2": 1729541921
     },
     "sum_of": [
      "r4",
      "r10"
     ]
    },
    {
     "id": "r12",
     "kind": "section",
     "label_ar": "المطلوبات"
    },
    {
     "id": "r13",
     "kind": "section",
     "label_ar": "المطلوبات غير المتداولة"
    },
    {
     "id": "r14",
     "kind": "item",
     "label_ar": "تسهيل تمويلي من بنك",
     "notes": [
      "9"
     ],
     "values": {
      "c1": 785924480,
      "c2": 615511202
     }
    },
    {
     "id": "r15",
     "kind": "subtotal",
     "label_ar": "مجموع المطلوبات غير المتداولة",
     "values": {
      "c1": 785924480,
      "c2": 615511202
     },
     "sum_of": [
      "r14"
     ]
    },
    {
     "id": "r16",
     "kind": "section",
     "label_ar": "المطلوبات المتداولة"
    },
    {
     "id": "r17",
     "kind": "item",
     "label_ar": "توزيعات أرباح مستحقة الدفع",
     "notes": [
      "10"
     ],
     "values": {
      "c1": 21296875,
      "c2": 9750000
     }
    },
    {
     "id": "r18",
     "kind": "item",
     "label_ar": "مستحق إلى جهة ذات علاقة",
     "notes": [
      "11"
     ],
     "values": {
      "c1": 15322392,
      "c2": 4500000
     }
    },
    {
     "id": "r19",
     "kind": "item",
     "label_ar": "مصروفات مستحقة الدفع وذمم دائنة أخرى",
     "notes": [
      "12"
     ],
     "values": {
      "c1": 2716258,
      "c2": 38655155
     }
    },
    {
     "id": "r20",
     "kind": "item",
     "label_ar": "إيرادات مؤجلة",
     "notes": [
      "13"
     ],
     "values": {
      "c1": 13482685,
      "c2": 17273031
     }
    },
    {
     "id": "r21",
     "kind": "item",
     "label_ar": "الجزء المتداول من التسهيل التمويلي من البنك",
     "notes": [
      "9"
     ],
     "values": {
      "c1": 8293739,
      "c2": 4141929
     }
    },
    {
     "id": "r22",
     "kind": "subtotal",
     "label_ar": "مجموع المطلوبات المتداولة",
     "values": {
      "c1": 61111949,
      "c2": 74320115
     },
     "sum_of": [
      "r17",
      "r18",
      "r19",
      "r20",
      "r21"
     ]
    },
    {
     "id": "r23",
     "kind": "total",
     "label_ar": "مجموع المطلوبات",
     "values": {
      "c1": 847036429,
      "c2": 689831317
     },
     "sum_of": [
      "r15",
      "r22"
     ]
    },
    {
     "id": "r24",
     "kind": "total",
     "label_ar": "صافي الموجودات العائدة لمالكي الوحدات",
     "values": {
      "c1": 997395948,
      "c2": 1039710604
     },
     "sum_of": [
      "r11",
      "-r23"
     ]
    },
    {
     "id": "r25",
     "kind": "item",
     "label_ar": "الوحدات المصدرة",
     "notes": [
      "14"
     ],
     "values": {
      "c1": 117500000,
      "c2": 117500000
     },
     "comment": "number of units"
    },
    {
     "id": "r26",
     "kind": "item",
     "label_ar": "صافي الموجودات لكل وحدة (بالريال السعودي)",
     "values": {
      "c1": 8.4885,
      "c2": 8.8486
     },
     "comment": "riyals per unit"
    }
   ]
  },
  {
   "id": "s2",
   "type": "income_and_comprehensive_income",
   "title_ar": "قائمة الدخل والدخل الشامل الآخر",
   "pages": [
    8
   ],
   "unit": {
    "currency": "SAR",
    "scale": 1
   },
   "columns": [
    {
     "id": "c1",
     "label": "2022م ريال سعودي",
     "currency": "SAR",
     "period": "2022-12-31"
    },
    {
     "id": "c2",
     "label": "2021م ريال سعودي",
     "currency": "SAR",
     "period": "2021-12-31"
    }
   ],
   "rows": [
    {
     "id": "r1",
     "kind": "section",
     "label_ar": "الدخل / (الخسارة)"
    },
    {
     "id": "r2",
     "kind": "item",
     "label_ar": "دخل إيجار",
     "values": {
      "c1": 137505273,
      "c2": 72898962
     }
    },
    {
     "id": "r3",
     "kind": "item",
     "label_ar": "دخل مرابحة",
     "notes": [
      "8 (أ)"
     ],
     "values": {
      "c1": 426567,
      "c2": 11314
     }
    },
    {
     "id": "r4",
     "kind": "item",
     "label_ar": "صافي مكسب / (خسارة) أدوات مشتقة بالقيمة العادلة من خلال قائمة الدخل",
     "values": {
      "c1": 21199241,
      "c2": -1231454
     }
    },
    {
     "id": "r5",
     "kind": "subtotal",
     "label_ar": "مجموع الدخل",
     "values": {
      "c1": 159131081,
      "c2": 71678822
     },
     "sum_of": [
      "r2",
      "r3",
      "r4"
     ]
    },
    {
     "id": "r6",
     "kind": "section",
     "label_ar": "المصروفات"
    },
    {
     "id": "r7",
     "kind": "item",
     "label_ar": "أتعاب إدارة وتنظيم وشريعة",
     "values": {
      "c1": 11127297,
      "c2": 5830518
     }
    },
    {
     "id": "r8",
     "kind": "item",
     "label_ar": "استهلاك",
     "notes": [
      "5"
     ],
     "values": {
      "c1": 29130449,
      "c2": 16194638
     }
    },
    {
     "id": "r9",
     "kind": "item",
     "label_ar": "أتعاب تمويلية ورسوم بنكية",
     "notes": [
      "9"
     ],
     "values": {
      "c1": 34525866,
      "c2": 12480293
     }
    },
    {
     "id": "r10",
     "kind": "item",
     "label_ar": "خسائر الائتمان المتوقعة للذمم المدينة المتعلقة بالإيجارات",
     "notes": [
      "7-1"
     ],
     "values": {
      "c1": 3500000,
      "c2": 249832
     }
    },
    {
     "id": "r11",
     "kind": "item",
     "label_ar": "محمل الانخفاض في قيمة عقارات استثمارية",
     "notes": [
      "5"
     ],
     "values": {
      "c1": 26839816,
      "c2": 60147719
     }
    },
    {
     "id": "r12",
     "kind": "item",
     "label_ar": "مصروفات تشغيل ومصروفات أخرى",
     "notes": [
      "15"
     ],
     "values": {
      "c1": 12897309,
      "c2": 12213597
     }
    },
    {
     "id": "r13",
     "kind": "subtotal",
     "label_ar": "مجموع المصروفات",
     "values": {
      "c1": 118020737,
      "c2": 107116597
     },
     "sum_of": [
      "r7",
      "r8",
      "r9",
      "r10",
      "r11",
      "r12"
     ]
    },
    {
     "id": "r14",
     "kind": "total",
     "label_ar": "صافي الدخل / (الخسارة) للسنة",
     "values": {
      "c1": 41110344,
      "c2": -35437775
     },
     "sum_of": [
      "r5",
      "-r13"
     ]
    },
    {
     "id": "r15",
     "kind": "item",
     "label_ar": "الدخل الشامل الآخر",
     "values": {
      "c1": "nil",
      "c2": "nil"
     }
    },
    {
     "id": "r16",
     "kind": "total",
     "label_ar": "مجموع الدخل الشامل / (الخسارة) للسنة",
     "values": {
      "c1": 41110344,
      "c2": -35437775
     },
     "sum_of": [
      "r14",
      "r15"
     ]
    }
   ]
  },
  {
   "id": "s3",
   "type": "changes_in_net_assets",
   "title_ar": "قائمة التغيرات في صافي الموجودات العائدة إلى مالكي الوحدات",
   "pages": [
    9
   ],
   "unit": {
    "currency": "SAR",
    "scale": 1
   },
   "columns": [
    {
     "id": "c1",
     "label": "2022م ريال سعودي",
     "currency": "SAR",
     "period": "2022-12-31"
    },
    {
     "id": "c2",
     "label": "2021م ريال سعودي",
     "currency": "SAR",
     "period": "2021-12-31"
    }
   ],
   "rows": [
    {
     "id": "r1",
     "kind": "item",
     "label_ar": "صافي الموجودات العائدة إلى مالكي الوحدات في 1 يناير",
     "values": {
      "c1": 1039710604,
      "c2": 537948379
     }
    },
    {
     "id": "r2",
     "kind": "item",
     "label_ar": "مجموع الدخل الشامل / (الخسارة) للسنة",
     "values": {